{
  "schema": "kori.marketplace.index.v1",
  "generated_at": "2026-08-26T11:43:13+00:00",
  "trust": "packages/trust.json",
  "schemas": [
    {
      "id": "kori.marketplace.index.v1",
      "path": "schema/v1/index.json"
    },
    {
      "id": "kori.package.v1",
      "path": "schema/v1/package.json"
    },
    {
      "id": "kori.publisher.v1",
      "path": "schema/v1/publisher.json"
    },
    {
      "id": "kori.trust.v1",
      "path": "schema/v1/trust.json"
    }
  ],
  "publishers": [
    {
      "id": "kori",
      "manifest": "packages/kori/publisher.json"
    }
  ],
  "packages": [
    {
      "id": "kori.uv",
      "name": "uv",
      "description": "Fast Python package and project manager.",
      "publisher": "kori",
      "latest": "0.12.6",
      "manifest": "packages/kori/uv/0.12.6/package.json"
    }
  ]
}
